{"schema_version": "2.0", "event": "concurso.disponivel", "event_id": "71d5e524-bd41-46aa-94e7-7b71503b4720", "produced_at": "2026-08-19T13:11:47.694343+00:00", "banca": "cesgranrio", "concurso": "bnb0124", "pasta_uri": "file:///home/otluiz/Workspace/LexLearn/LexLearn-v3/data/raw/exams/cesgranrio/bnb0124/", "arquivos": [{"nome": "bnb0124_gabarito_final_banco_do_nordeste.pdf", "papel": "gabarito_definitivo", "cargos": ["banco_do_nordeste"], "checksum_sha256": "12283085cbfacc837932ce92d2df70b1a5e12ea634399ecfa39272778d5f7f04", "tamanho_bytes": 116429, "multi_cargo": false, "vigente": true}, {"nome": "bnb0124_gabaritos_analista_bancario_1.pdf", "papel": "gabarito_preliminar", "cargos": ["analista_bancario_1"], "checksum_sha256": "bba646e61e3dcfe6923e76bfb3448df3d735f138918a2c1990f0e349fdaf5899", "tamanho_bytes": 294532, "multi_cargo": false, "vigente": true}, {"nome": "bnb0124_prova_analista_bancario_1_gabarito_1.pdf", "papel": "prova", "cargos": ["analista_bancario_1"], "checksum_sha256": "a6b484be1560f0b483a1b114c6bbc3bf39113adc9930cb0a03e8927e45eedce0", "tamanho_bytes": 984266, "tipo_prova": "gabarito_1", "multi_cargo": false, "vigente": true}, {"nome": "bnb0124_prova_analista_bancario_1_gabarito_2.pdf", "papel": "prova", "cargos": ["analista_bancario_1"], "checksum_sha256": "2c7b5c3092306b8a1197847e26940a3d7c8ce8cccd15b4472fd988783227977c", "tamanho_bytes": 1007621, "tipo_prova": "gabarito_2", "multi_cargo": false, "vigente": true}, {"nome": "bnb0124_prova_analista_bancario_1_gabarito_3.pdf", "papel": "prova", "cargos": ["analista_bancario_1"], "checksum_sha256": "c5c01541235f317dfb3da0ac9e5d452f88084e5cf49d0f47fc08a3368432736e", "tamanho_bytes": 985614, "tipo_prova": "gabarito_3", "multi_cargo": false, "vigente": true}], "fonte_url": "https://concursos.cesgranrio.org.br/media/gpoweb-prd-hibrido3/eventos/10/conteudos/251ff905-3ec5-42c0-9bcf-49ada57ae6e1.pdf?sv=2025-01-05&se=2036-08-16T13%3A11%3A36Z&sr=c&sp=r&sig=40J8i9LW714R9QeHLKyz3TYOUAkL8XQQrxR9w7lcfuk%3D", "extra": {"rotulos": {"banca": "CESGRANRIO", "concurso": "BNB - EDITAL N.º 01/2024", "cargos": {"banco_do_nordeste": "BANCO DO NORDESTE", "analista_bancario_1": "ANALISTA BANCÁRIO 1"}}}}