{"schema_version": "2.0", "event": "concurso.disponivel", "event_id": "44082d04-479b-4c2b-9df6-d6e08d3daadf", "produced_at": "2026-08-04T14:00:02.745642+00:00", "banca": "cebraspe", "concurso": "prf_2021_2021", "pasta_uri": "file:///home/otluiz/Workspace/LexLearn/LexLearn-v3/data/raw/exams/cebraspe/prf_2021_2021/", "arquivos": [{"nome": "Gab_Definitivo_085_PRFCF_001_01.pdf", "papel": "gabarito_definitivo", "cargos": ["policial_rodoviario_federal"], "checksum_sha256": "d4d0989b43e18e5cc4e6bcc88771eb21ef28cb283d9b799eaf892d79413b8b3e", "tamanho_bytes": 210230, "multi_cargo": false, "vigente": true}, {"nome": "Gab_Definitivo_091_PRFCF2_001_01.pdf", "papel": "gabarito_definitivo", "cargos": ["policial_rodoviario_federal"], "checksum_sha256": "43c48e7dc4c94e80e6d895b45afe448f190e3918eadf87a5b334871acea865cf", "tamanho_bytes": 209272, "multi_cargo": false, "vigente": true}, {"nome": "091_PRFCF2_001_01.pdf", "papel": "prova", "cargos": ["policial_rodoviario_federal"], "checksum_sha256": "23e339adca8558f19eb26171f28df09db5b146575d7e21f0f201202f3c24dbb3", "tamanho_bytes": 61126, "multi_cargo": false, "vigente": true}, {"nome": "085_PRFCF_001_01.pdf", "papel": "prova", "cargos": ["policial_rodoviario_federal"], "checksum_sha256": "be8a9b3cdbb93b6046667e832e2b4765a438fff5d09ac14782e4f9a3750dc7b2", "tamanho_bytes": 49156, "multi_cargo": false, "vigente": true}, {"nome": "GAB_DEFINITIVO_746_PRF_21_CFP_2_001_01.PDF", "papel": "gabarito_definitivo", "cargos": ["policial_rodoviario_federal"], "checksum_sha256": "d4158248ee81a0cc4cdbd189ee3e27b3f4c93ef331d6cac40abc9fbf28d5e74c", "tamanho_bytes": 68048, "multi_cargo": false, "vigente": true}, {"nome": "746_PRF_21_CFP_2_001_01.PDF", "papel": "prova", "cargos": ["policial_rodoviario_federal"], "checksum_sha256": "b5abdacbb7e373f39efbe6a20332ae54fab33123c1afcdbcfecaf226ccbbe26e", "tamanho_bytes": 60156, "multi_cargo": false, "vigente": true}, {"nome": "699_PRF_CF_001_01.PDF", "papel": "prova", "cargos": ["policial_rodoviario_federal"], "checksum_sha256": "7a774895266672bd290f79fa472d91eeca66df848491fc568a33b0a324815e53", "tamanho_bytes": 68163, "multi_cargo": false, "vigente": true}, {"nome": "GAB_PRELIMINAR_699_PRF_CF_001_01.PDF", "papel": "gabarito_preliminar", "cargos": ["policial_rodoviario_federal"], "checksum_sha256": "377310fbcac7002212afc286faf2ac04fe84ae51d9d17069bc8525200740d57e", "tamanho_bytes": 76315, "multi_cargo": false, "vigente": true}, {"nome": "633_PRF_CF_001.PDF", "papel": "prova", "cargos": ["policial_rodoviario_federal"], "checksum_sha256": "678a8755fa655ba8c02cbc1c2231ef75c0730fdd873fb297a5ea600c1f9a24fd", "tamanho_bytes": 498419, "multi_cargo": false, "vigente": true}, {"nome": "GAB_PRELIMINAR_633_PRF_001_00.PDF", "papel": "gabarito_preliminar", "cargos": ["policial_rodoviario_federal"], "checksum_sha256": "f3c6820a159a39047478442ef3211b7207d1cc4334832f1a37b6cb6aa9d8490a", "tamanho_bytes": 461867, "multi_cargo": false, "vigente": true}, {"nome": "GAB_PRELIMINAR_632_PRF_001_01.PDF", "papel": "gabarito_preliminar", "cargos": ["policial_rodoviario_federal"], "checksum_sha256": "338cf43abfafd27ec06600ab4b22180168db4774038913c7009f0433d90cfe6e", "tamanho_bytes": 78122, "multi_cargo": false, "vigente": true}, {"nome": "632_PRF_CF_001_01.PDF", "papel": "prova", "cargos": ["policial_rodoviario_federal"], "checksum_sha256": "1220fec2f6d3b19f2abb69ced808040ed23ea5e62c4fb034ff24c9bb3af140b9", "tamanho_bytes": 65004, "multi_cargo": false, "vigente": true}, {"nome": "578_PRF_ING_01.PDF", "papel": "prova", "cargos": ["policial_rodoviario_federal"], "checksum_sha256": "a822464ff171e2c8a4182793f614f2968422a59f3817fd4894ff95732126fceb", "tamanho_bytes": 39773, "multi_cargo": false, "vigente": true}, {"nome": "578_PRF_ESP_02.PDF", "papel": "prova", "cargos": ["policial_rodoviario_federal"], "checksum_sha256": "f54bc699f65f61f7bb8584747d45abda762b96e16f3dcca7962881232b89982f", "tamanho_bytes": 40679, "multi_cargo": false, "vigente": true}, {"nome": "578_PRF_001_01.PDF", "papel": "prova", "cargos": ["policial_rodoviario_federal"], "checksum_sha256": "6c795d351085976400c140bf89a06bf9ff9fcbb0624a7401b991caa961d7a02f", "tamanho_bytes": 114833, "multi_cargo": false, "vigente": true}, {"nome": "GAB_DEFINITIVO_578_PRF_ING_01.PDF", "papel": "gabarito_definitivo", "cargos": ["policial_rodoviario_federal"], "checksum_sha256": "42941321359886c0dd8d4eb3c0feee6f438882d5301f5198d7976d6b1b8fbd2f", "tamanho_bytes": 27663, "multi_cargo": false, "vigente": true}, {"nome": "GAB_DEFINITIVO_578_PRF_ESP_02.PDF", "papel": "gabarito_definitivo", "cargos": ["policial_rodoviario_federal"], "checksum_sha256": "bf7d12e9a6171e1cfa3b095124ec484069f8c80048ce55c8b8174208367481f8", "tamanho_bytes": 27758, "multi_cargo": false, "vigente": true}, {"nome": "GAB_DEFINITIVO_578_PRF_001_01.PDF", "papel": "gabarito_definitivo", "cargos": ["policial_rodoviario_federal"], "checksum_sha256": "48b945fad23ba4ac4af8ef2eb48f097a8fe1fe078d7abaa7773e519cc7d7cab5", "tamanho_bytes": 28230, "multi_cargo": false, "vigente": true}, {"nome": "PRF_21_PADRAO_DE_RESPOSTA_DEFINITIVO.PDF", "papel": "prova", "cargos": ["policial_rodoviario_federal"], "checksum_sha256": "5d95b8876e8a74bcbee5c896f55e07af6330b6324f7af8e8b9829bf2fb017211", "tamanho_bytes": 121411, "multi_cargo": false, "vigente": true}, {"nome": "PRF_21_PROVA_DISCURSIVA.PDF", "papel": "prova", "cargos": ["policial_rodoviario_federal"], "checksum_sha256": "2f4e887ea8966959ec3992e41ce4b56994c92ce8defd060c282bcfe145bcef15", "tamanho_bytes": 111775, "multi_cargo": false, "vigente": true}], "fonte_url": "https://cdn.cebraspe.org.br/concursos/prf_21/arquivos/Gab_Definitivo_085_PRFCF_001_01.pdf", "extra": {"rotulos": {"banca": "CEBRASPE", "concurso": "POLÍCIA RODOVIÁRIA FEDERAL", "cargos": {"policial_rodoviario_federal": "POLICIAL RODOVIÁRIO FEDERAL"}}}}